{
  "$id": "https://kgfoundry/schemas/kgfoundry.search_api.app.SearchResult.json#",
  "$schema": "https://json-schema.org/draft/2020-12/schema",
  "description": "Describe SearchResult.\n\n<!-- auto:docstring-builder v1 -->\n\nthe behaviour it provides to callers. Callers interact with\nvalidated data through this model.\n\nParameters\n----------\ndoc_id : str\n    Describe ``doc_id``.\nchunk_id : str\n    Describe ``chunk_id``.\ntitle : str\n    Describe ``title``.\nsection : str\n    Describe ``section``.\nscore : float\n    Describe ``score``.\nsignals : dict[str, float], optional\n    Describe ``signals``.\n    Defaults to ``<factory>``.\nspans : dict[str, int], optional\n    Describe ``spans``.\n    Defaults to ``<factory>``.\nconcepts : list[dict[str, str]], optional\n    Describe ``concepts``.\n    Defaults to ``<factory>``.",
  "examples": [
    {
      "chunk_id": null,
      "concepts": null,
      "doc_id": null,
      "score": null,
      "section": null,
      "signals": null,
      "spans": null,
      "title": null
    }
  ],
  "properties": {
    "chunk_id": {
      "title": "Chunk Id",
      "type": "string"
    },
    "concepts": {
      "items": {
        "additionalProperties": {
          "type": "string"
        },
        "type": "object"
      },
      "title": "Concepts",
      "type": "array"
    },
    "doc_id": {
      "title": "Doc Id",
      "type": "string"
    },
    "score": {
      "title": "Score",
      "type": "number"
    },
    "section": {
      "title": "Section",
      "type": "string"
    },
    "signals": {
      "additionalProperties": {
        "type": "number"
      },
      "title": "Signals",
      "type": "object"
    },
    "spans": {
      "additionalProperties": {
        "type": "integer"
      },
      "title": "Spans",
      "type": "object"
    },
    "title": {
      "title": "Title",
      "type": "string"
    }
  },
  "required": [
    "doc_id",
    "chunk_id",
    "title",
    "section",
    "score"
  ],
  "title": "SearchResult",
  "type": "object"
}
